[
  {
    "id": "infra-001",
    "domain": "Backstage Infrastructure",
    "competency": "Understand the Backstage framework",
    "difficulty": "easy",
    "question": "Which statement best describes what Backstage is?",
    "options": {
      "A": "An open source framework for building developer portals",
      "B": "A container orchestration platform",
      "C": "A managed CI/CD pipeline service",
      "D": "A public cloud hosting provider"
    },
    "answer": "A",
    "explanation": "Backstage is an open source framework for building developer portals, unifying tooling, services, and docs. It is not an orchestrator, CI/CD service, or hosting provider.",
    "source": "https://backstage.io/docs/overview/what-is-backstage",
    "tags": [
      "framework",
      "definition"
    ]
  },
  {
    "id": "infra-002",
    "domain": "Backstage Infrastructure",
    "competency": "Understand the Backstage framework",
    "difficulty": "easy",
    "question": "Which company originally created Backstage, and which foundation stewards it today?",
    "options": {
      "A": "Created by Google; now an Apache Software Foundation project",
      "B": "Created by Spotify; now a CNCF project",
      "C": "Created by Netflix; now an OpenJS Foundation project",
      "D": "Created by Microsoft; now a Cloud Foundry project"
    },
    "answer": "B",
    "explanation": "Backstage was created by Spotify and donated to the Cloud Native Computing Foundation (CNCF), where it is an incubating project.",
    "source": "https://backstage.io/docs/overview/what-is-backstage",
    "tags": [
      "spotify",
      "cncf"
    ]
  },
  {
    "id": "infra-003",
    "domain": "Backstage Infrastructure",
    "competency": "Understand the Backstage framework",
    "difficulty": "medium",
    "question": "Which three capabilities are highlighted as the core features of Backstage?",
    "options": {
      "A": "Pipelines, Runners, and Artifacts",
      "B": "Pods, Services, and Ingresses",
      "C": "Software Catalog, Software Templates, and TechDocs",
      "D": "Dashboards, Alerts, and Log streams"
    },
    "answer": "C",
    "explanation": "The Software Catalog, Software Templates (Scaffolder), and TechDocs are the three core features, extended by a plugin ecosystem. The other options are Kubernetes/CI/observability concepts.",
    "source": "https://backstage.io/docs/overview/what-is-backstage",
    "tags": [
      "catalog",
      "templates",
      "techdocs"
    ]
  },
  {
    "id": "infra-004",
    "domain": "Backstage Infrastructure",
    "competency": "Configure Backstage",
    "difficulty": "easy",
    "question": "Which file holds the primary static configuration for a Backstage instance?",
    "options": {
      "A": "settings.xml",
      "B": "backstage.json",
      "C": "config.toml",
      "D": "app-config.yaml"
    },
    "answer": "D",
    "explanation": "Backstage reads configuration from `app-config.yaml` (with environment-specific overrides like app-config.production.yaml). The other filenames are not used.",
    "source": "https://backstage.io/docs/conf/",
    "tags": [
      "configuration",
      "app-config"
    ]
  },
  {
    "id": "infra-005",
    "domain": "Backstage Infrastructure",
    "competency": "Configure Backstage",
    "difficulty": "easy",
    "question": "Which file is intended to override configuration locally during development without committing it?",
    "options": {
      "A": "app-config.local.yaml",
      "B": "app-config.dev.json",
      "C": ".env.backstage",
      "D": "local-config.yaml"
    },
    "answer": "A",
    "explanation": "`app-config.local.yaml` is git-ignored by default and layered on top of app-config.yaml for local development, making it the place for local secrets/overrides.",
    "source": "https://backstage.io/docs/conf/",
    "tags": [
      "configuration",
      "local-override"
    ]
  },
  {
    "id": "infra-006",
    "domain": "Backstage Infrastructure",
    "competency": "Deploy Backstage to production",
    "difficulty": "medium",
    "question": "Which databases does Backstage typically use for development and for production, respectively?",
    "options": {
      "A": "MySQL for development and Oracle for production",
      "B": "SQLite for development and PostgreSQL for production",
      "C": "MongoDB for both development and production",
      "D": "PostgreSQL for development and SQLite for production"
    },
    "answer": "B",
    "explanation": "Development defaults to an in-memory SQLite database, while PostgreSQL is the preferred production database. Option D reverses the two.",
    "source": "https://backstage.io/docs/overview/architecture-overview",
    "tags": [
      "database",
      "postgres",
      "sqlite"
    ]
  },
  {
    "id": "infra-007",
    "domain": "Backstage Infrastructure",
    "competency": "Understand Backstage client-server architecture",
    "difficulty": "medium",
    "question": "How do the Backstage frontend and backend primarily communicate?",
    "options": {
      "A": "Only through a shared message queue",
      "B": "Through direct in-process function calls",
      "C": "The React frontend calls the backend over HTTP APIs",
      "D": "Over a custom binary protocol on raw TCP sockets"
    },
    "answer": "C",
    "explanation": "Backstage follows a client-server model: the frontend single-page app makes HTTP API requests to backend plugins. Plugins communicate 'over the wire' rather than via direct code dependencies.",
    "source": "https://backstage.io/docs/overview/architecture-overview",
    "tags": [
      "client-server",
      "http"
    ]
  },
  {
    "id": "infra-008",
    "domain": "Backstage Infrastructure",
    "competency": "Understand Backstage client-server architecture",
    "difficulty": "medium",
    "question": "The Backstage architecture overview divides a deployment into which three parts?",
    "options": {
      "A": "Ingress, Service, and Pod",
      "B": "Client, Server, and Cache",
      "C": "Model, View, and Controller",
      "D": "Core, App, and Plugins"
    },
    "answer": "D",
    "explanation": "Backstage is described in terms of the Core (base functionality), the App (a deployed, customized instance), and Plugins (added functionality). The others are unrelated patterns/objects.",
    "source": "https://backstage.io/docs/overview/architecture-overview",
    "tags": [
      "architecture",
      "core-app-plugins"
    ]
  },
  {
    "id": "infra-009",
    "domain": "Backstage Infrastructure",
    "competency": "Understand Backstage client-server architecture",
    "difficulty": "hard",
    "question": "How does the Backstage backend isolate each plugin's data in the database?",
    "options": {
      "A": "It provisions a separate logical database per plugin via Knex",
      "B": "All plugins share a single global table",
      "C": "Each plugin requires its own dedicated database server",
      "D": "Plugins are not allowed to use a database"
    },
    "answer": "A",
    "explanation": "Using the Knex library, the backend sets up a separate logical database per plugin, isolating plugin data while still targeting one database engine (e.g., PostgreSQL).",
    "source": "https://backstage.io/docs/overview/architecture-overview",
    "tags": [
      "database",
      "knex",
      "plugins"
    ]
  },
  {
    "id": "infra-010",
    "domain": "Backstage Infrastructure",
    "competency": "Configure Backstage",
    "difficulty": "easy",
    "question": "Which syntax substitutes an environment variable's value into app-config.yaml?",
    "options": {
      "A": "%MY_VAR%",
      "B": "{{MY_VAR}}",
      "C": "${MY_VAR}",
      "D": "$(MY_VAR)"
    },
    "answer": "C",
    "explanation": "Backstage config supports ${MY_VAR} substitution, with ${MY_VAR:-default} for defaults and $${...} to escape it.",
    "source": "https://backstage.io/docs/conf/writing",
    "tags": [
      "configuration",
      "env"
    ]
  },
  {
    "id": "infra-011",
    "domain": "Backstage Infrastructure",
    "competency": "Configure Backstage",
    "difficulty": "easy",
    "question": "In app-config.yaml, which special key reads a value directly from an environment variable?",
    "options": {
      "A": "$secret",
      "B": "$ref",
      "C": "$var",
      "D": "$env"
    },
    "answer": "D",
    "explanation": "The $env marker reads a string from an environment variable; $file reads a file and $include loads a JSON/YAML fragment.",
    "source": "https://backstage.io/docs/conf/writing",
    "tags": [
      "configuration",
      "env"
    ]
  },
  {
    "id": "infra-012",
    "domain": "Backstage Infrastructure",
    "competency": "Deploy Backstage to production",
    "difficulty": "medium",
    "question": "In a Backstage deployment, which part is the server responsible for wiring plugins together?",
    "options": {
      "A": "The backend",
      "B": "The frontend single-page app",
      "C": "The PostgreSQL database",
      "D": "The reverse proxy"
    },
    "answer": "A",
    "explanation": "The backend is the server-side part that wires things together and is deployed as one or more instances.",
    "source": "https://backstage.io/docs/overview/architecture-overview",
    "tags": [
      "deployment",
      "backend"
    ]
  },
  {
    "id": "infra-013",
    "domain": "Backstage Infrastructure",
    "competency": "Configure Backstage",
    "difficulty": "hard",
    "question": "Which environment variable overrides the config value app.baseUrl?",
    "options": {
      "A": "BACKSTAGE_app_baseUrl",
      "B": "APP_CONFIG_app_baseUrl",
      "C": "CONFIG_APP_BASE_URL",
      "D": "BS_app__baseUrl"
    },
    "answer": "B",
    "explanation": "APP_CONFIG_-prefixed variables override config values, replacing dots with underscores (e.g., APP_CONFIG_app_baseUrl).",
    "source": "https://backstage.io/docs/conf/writing",
    "tags": [
      "configuration",
      "env-override"
    ]
  }
]
